{
  "$schema": "http://json-schema.org/draft-07/schema#",
  "title": "CQL Test Configuration",
  "description": "Schema for validating CQL test configuration files",
  "type": "object",
  "properties": {
    "FhirServer": {
      "type": "object",
      "description": "FHIR server configuration",
      "properties": {
        "BaseUrl": {
          "type": "string",
          "format": "uri",
          "description": "Base URL of the FHIR server"
        },
        "ogBaseUrl": {
          "type": "string",
          "format": "uri",
          "description": "Original base URL (optional, used for fallback)"
        },
        "CqlOperation": {
          "type": "string",
          "enum": ["$cql", "$evaluate"],
          "description": "CQL operation used to evaluate tests: the system-level $cql operation, or Library/$evaluate",
          "default": "$cql"
        }
      },
      "required": ["BaseUrl", "CqlOperation"],
      "additionalProperties": false
    },
    "Build": {
      "type": "object",
      "description": "Build configuration settings",
      "properties": {
        "CqlFileVersion": {
          "type": "string",
          "pattern": "^\\d+\\.\\d+\\.\\d+$",
          "description": "CQL file version in semantic versioning format"
        },
        "CqlOutputPath": {
          "type": "string",
          "description": "Path where CQL files are output"
        },
        "CqlVersion": {
          "type": "string",
          "pattern": "^\\d+\\.\\d+(\\.\\d+)?$",
          "description": "CQL engine version for version-based test filtering (optional)"
        },
        "testsRunDescription":{
          "type": "string",
          "description": "Information about this test run"
        },
        "cqlTranslator": {
          "type": "string",
          "description": "Which CQL Translator is used in this test run."
        },
        "cqlTranslatorVersion": {
          "type": "string",
          "description": "Which CQL translator version is used in this test run"
        },
        "cqlEngine": {
          "type": "string",
          "description": "Which CQL engine is used in this test run"
        },
        "cqlEngineVersion": {
          "type": "string",
          "description": "Which version of the CQL engine is used in this test run"
        }
      },
      "required": ["CqlFileVersion", "CqlOutputPath"],
      "additionalProperties": false
    },
    "Debug": {
      "type": "object",
      "description": "Debug configuration settings",
      "properties": {
        "QuickTest": {
          "type": "boolean",
          "description": "Whether to run quick tests only"
        }
      },
      "required": ["QuickTest"],
      "additionalProperties": false
    },
    "Tests": {
      "type": "object",
      "description": "Test configuration settings",
      "properties": {
        "ResultsPath": {
          "type": "string",
          "description": "Path where test results are stored"
        },
        "SkipList": {
          "type": "array",
          "description": "List of tests to skip. An entry with only testsName skips the whole suite; adding groupName skips that group; adding testName skips that test.",
          "items": {
            "type": "object",
            "properties": {
              "testsName": {
                "type": "string",
                "description": "Name of the test suite"
              },
              "groupName": {
                "type": "string",
                "description": "Name of the test group"
              },
              "testName": {
                "type": "string",
                "description": "Name of the specific test"
              },
              "reason": {
                "type": "string",
                "description": "Reason for skipping the test"
              }
            },
            "required": ["testsName", "reason"],
            "additionalProperties": false
          }
        },
        "OnlyList": {
          "type": "array",
          "description": "List of tests to run exclusively. An entry with only testsName selects the whole suite; adding groupName selects that group; adding testName selects that test.",
          "items": {
            "type": "object",
            "properties": {
              "testsName": {
                "type": "string",
                "description": "Name of the test suite"
              },
              "groupName": {
                "type": "string",
                "description": "Name of the test group"
              },
              "testName": {
                "type": "string",
                "description": "Name of the specific test"
              }
            },
            "required": ["testsName"],
            "additionalProperties": false
          }
        }
      },
      "required": ["ResultsPath", "SkipList"],
      "additionalProperties": false
    }
  },
  "required": ["FhirServer", "Build", "Debug", "Tests"],
  "additionalProperties": false
}
