{
  "FhirServer": {
    "BaseUrl": "http://localhost:8080/fhir/",
    "CqlOperation": "$cql"
  },
  "Build": {
    "CqlFileVersion": "1.0.0",
    "CqlOutputPath": "./cql",
    "CqlVersion": "1.5",
    "testsRunDescription": "Local host test run",
    "cqlTranslator": "Java CQFramework Translator",
    "cqlTranslatorVersion": "Unknown",
    "cqlEngine": "Java CQFramework Engine",
    "cqlEngineVersion": "4.1.0"
  },
  "Debug": {
    "QuickTest": false
  },
  "Tests": {
    "ResultsPath": "./results",
    "SkipList": [
      {
        "testsName": "CqlAggregateTest",
        "groupName": "AggregateTests",
        "testName": "RolledOutIntervals",
        "reason": "CQLtoELM - Could not resolve identifier MedicationRequestIntervals in the current library"
      },
      {
        "testsName": "CqlDateTimeOperatorsTest",
        "groupName": "DateTimeComponentFrom",
        "testName": "DateTimeComponentFromTimezone",
        "reason": "CQLtoElm - Timezone keyword is only valid in 1.3 or lower"
      },
      {
        "testsName": "CqlDateTimeOperatorsTest",
        "groupName": "Uncertainty tests",
        "testName": "TimeDurationBetweenHourDiffPrecision",
        "reason": "CQLtoELM - Syntax error at Z"
      }
    ]
  }
}
