{
  "FhirServer": {
    "BaseUrl": "http://localhost:8000/",
    "ogBaseUrl": "https://cloud.alphora.com/sandbox/r4/cds/fhir/",
    "CqlOperation": "$cql"
  },
  "Build": {
    "CqlFileVersion": "1.0.000",
    "CqlOutputPath": "./cql",
    "CqlVersion": "1.5",
    "testsRunDescription": "Smile-cdr-local test run",
    "cqlTranslator": "Java CQFramework Translator",
    "cqlTranslatorVersion": "Unknown",
    "cqlEngine": "Java CQFramework Engine",
    "cqlEngineVersion": "Unknown"
  },
  "Debug": {
    "QuickTest": false
  },
  "Tests": {
    "ResultsPath": "./results",
    "SkipList": [
      {
        "testsName": "CqlAggregateTest",
        "groupName": "AggregateTests",
        "testName": "RolledOutIntervals",
        "reason": "CQLtoELM - Expected an expression of type 'decimal', but found an expression of type 'System.Integer' in Quantity{ value: duration in days of X }. Tracked in https://github.com/cqframework/cql-tests-runner/issues/133"
      },
      {
        "testsName": "CqlDateTimeOperatorsTest",
        "groupName": "DateTimeComponentFrom",
        "testName": "DateTimeComponentFromTimezone",
        "reason": "CQLtoElm - Timezone keyword is only valid in 1.3 or lower"
      },
      {
        "testsName": "CqlDateTimeOperatorsTest",
        "groupName": "Uncertainty tests",
        "testName": "TimeDurationBetweenHourDiffPrecision",
        "reason": "CQLtoELM - Syntax error at Z"
      }
    ]
  }
}
